{
  "buildingId": "wheeler",
  "levelId": "L4",
  "imageSize": [
    1934,
    3000
  ],
  "generatedAt": "2026-09-17T05:05:27+00:00",
  "pipelineVersion": "0.1.0",
  "outline": [
    [
      0.0,
      382.0
    ],
    [
      0.0,
      2005.0
    ],
    [
      29.4,
      2005.0
    ],
    [
      30.3,
      1649.0
    ],
    [
      30.3,
      1480.5
    ],
    [
      44.0,
      1480.5
    ],
    [
      49.0,
      1466.0
    ],
    [
      74.0,
      1459.5
    ],
    [
      106.0,
      1459.5
    ],
    [
      110.0,
      1448.0
    ],
    [
      189.0,
      1448.0
    ],
    [
      195.0,
      1428.5
    ],
    [
      222.5,
      1428.5
    ],
    [
      222.5,
      1591.5
    ],
    [
      150.5,
      1591.5
    ],
    [
      150.5,
      1915.0
    ],
    [
      407.5,
      1915.0
    ],
    [
      407.5,
      1943.5
    ],
    [
      628.0,
      1943.5
    ],
    [
      633.0,
      1941.0
    ],
    [
      1335.0,
      1941.0
    ],
    [
      1344.0,
      1956.0
    ],
    [
      1568.5,
      1956.0
    ],
    [
      1568.5,
      1920.5
    ],
    [
      1818.0,
      1920.5
    ],
    [
      1821.5,
      1918.0
    ],
    [
      1821.5,
      1596.5
    ],
    [
      1764.6,
      1596.5
    ],
    [
      1765.7,
      1384.0
    ],
    [
      1765.7,
      764.0
    ],
    [
      1834.0,
      764.0
    ],
    [
      1834.0,
      597.5
    ],
    [
      1851.0,
      597.5
    ],
    [
      1851.0,
      585.0
    ],
    [
      1879.2,
      585.0
    ],
    [
      1879.4,
      600.0
    ],
    [
      1879.4,
      562.0
    ],
    [
      1862.0,
      562.0
    ],
    [
      1858.0,
      547.0
    ],
    [
      1841.0,
      547.0
    ],
    [
      1833.0,
      533.0
    ],
    [
      1833.0,
      432.0
    ],
    [
      155.0,
      432.0
    ],
    [
      149.0,
      452.0
    ],
    [
      149.0,
      754.0
    ],
    [
      219.5,
      754.0
    ],
    [
      219.5,
      889.5
    ],
    [
      183.0,
      889.5
    ],
    [
      175.0,
      886.0
    ],
    [
      175.0,
      869.0
    ],
    [
      170.0,
      877.0
    ],
    [
      151.0,
      877.0
    ],
    [
      142.0,
      888.0
    ],
    [
      120.0,
      888.0
    ],
    [
      116.0,
      881.5
    ],
    [
      95.0,
      881.5
    ],
    [
      93.0,
      876.0
    ],
    [
      78.0,
      883.0
    ],
    [
      38.0,
      883.0
    ],
    [
      35.0,
      872.5
    ],
    [
      26.5,
      872.5
    ],
    [
      26.5,
      382.0
    ]
  ],
  "voids": [
    [
      [
        700.0,
        924.0
      ],
      [
        668.0,
        962.0
      ],
      [
        651.0,
        1001.0
      ],
      [
        606.0,
        1049.0
      ],
      [
        581.5,
        1116.0
      ],
      [
        581.5,
        1462.0
      ],
      [
        594.0,
        1516.0
      ],
      [
        623.0,
        1562.0
      ],
      [
        680.0,
        1604.0
      ],
      [
        713.0,
        1617.5
      ],
      [
        750.0,
        1617.8
      ],
      [
        1241.0,
        1617.8
      ],
      [
        1293.0,
        1605.0
      ],
      [
        1336.0,
        1577.0
      ],
      [
        1370.0,
        1535.0
      ],
      [
        1392.0,
        1473.0
      ],
      [
        1391.5,
        1129.0
      ],
      [
        1391.5,
        1095.0
      ],
      [
        1373.0,
        1057.0
      ],
      [
        1309.0,
        980.0
      ],
      [
        1212.0,
        904.0
      ],
      [
        1148.0,
        883.0
      ],
      [
        795.0,
        883.0
      ],
      [
        743.0,
        896.0
      ]
    ]
  ],
  "nodes": [
    {
      "id": "wheeler-L4-n000",
      "x": 599.0,
      "y": 797.0,
      "kind": "junction",
      "confidence": 0.8
    },
    {
      "id": "wheeler-L4-n001",
      "x": 1303.2,
      "y": 805.0,
      "kind": "junction",
      "confidence": 0.8
    },
    {
      "id": "wheeler-L4-n002",
      "x": 1491.0,
      "y": 1754.2,
      "kind": "junction",
      "confidence": 0.8
    },
    {
      "id": "wheeler-L4-n003",
      "x": 483.0,
      "y": 1791.0,
      "kind": "junction",
      "confidence": 0.8
    },
    {
      "id": "wheeler-L4-v01j",
      "x": 563.0,
      "y": 644.0,
      "kind": "junction",
      "confidence": 0.6
    },
    {
      "id": "wheeler-L4-v01",
      "x": 503.5,
      "y": 570.0,
      "kind": "stair",
      "confidence": 0.7
    },
    {
      "id": "wheeler-L4-v02j",
      "x": 1439.0,
      "y": 652.0,
      "kind": "junction",
      "confidence": 0.6
    },
    {
      "id": "wheeler-L4-v02",
      "x": 1475.0,
      "y": 575.8,
      "kind": "stair",
      "confidence": 0.7
    },
    {
      "id": "wheeler-L4-v03",
      "x": 1301.3,
      "y": 734.6,
      "kind": "elevator",
      "confidence": 0.7
    },
    {
      "id": "wheeler-L4-v04j",
      "x": 510.7,
      "y": 880.7,
      "kind": "junction",
      "confidence": 0.6
    },
    {
      "id": "wheeler-L4-v04",
      "x": 606.8,
      "y": 903.2,
      "kind": "elevator",
      "confidence": 0.7
    },
    {
      "id": "wheeler-L4-v05",
      "x": 515.9,
      "y": 1864.4,
      "kind": "stair",
      "confidence": 0.7
    },
    {
      "id": "wheeler-L4-v06j",
      "x": 1457.2,
      "y": 1754.0,
      "kind": "junction",
      "confidence": 0.6
    },
    {
      "id": "wheeler-L4-v06",
      "x": 1456.6,
      "y": 1869.0,
      "kind": "stair",
      "confidence": 0.7
    }
  ],
  "edges": [
    {
      "id": "wheeler-L4-e000",
      "a": "wheeler-L4-n000",
      "b": "wheeler-L4-n001",
      "kind": "corridor",
      "polyline": [
        [
          599.0,
          797.0
        ],
        [
          669.0,
          798.0
        ],
        [
          696.0,
          821.0
        ],
        [
          1213.0,
          823.0
        ],
        [
          1242.0,
          852.0
        ],
        [
          1287.0,
          852.0
        ],
        [
          1296.0,
          843.0
        ],
        [
          1296.0,
          815.0
        ],
        [
          1303.2,
          805.0
        ]
      ],
      "confidence": 0.8
    },
    {
      "id": "wheeler-L4-e001a",
      "a": "wheeler-L4-n002",
      "b": "wheeler-L4-v06j",
      "kind": "corridor",
      "polyline": [
        [
          1491.0,
          1754.2
        ],
        [
          1457.2,
          1754.0
        ]
      ],
      "confidence": 0.8
    },
    {
      "id": "wheeler-L4-e002aa",
      "a": "wheeler-L4-n002",
      "b": "wheeler-L4-v02j",
      "kind": "corridor",
      "polyline": [
        [
          1491.0,
          1754.2
        ],
        [
          1547.0,
          1754.0
        ],
        [
          1551.0,
          1746.0
        ],
        [
          1550.0,
          1309.0
        ],
        [
          1557.0,
          808.0
        ],
        [
          1552.0,
          801.0
        ],
        [
          1497.0,
          801.0
        ],
        [
          1482.0,
          788.0
        ],
        [
          1460.0,
          787.8
        ],
        [
          1461.0,
          694.0
        ],
        [
          1442.0,
          675.0
        ],
        [
          1439.0,
          652.0
        ]
      ],
      "confidence": 0.8
    },
    {
      "id": "wheeler-L4-e002ba",
      "a": "wheeler-L4-v01j",
      "b": "wheeler-L4-v04j",
      "kind": "corridor",
      "polyline": [
        [
          563.0,
          644.0
        ],
        [
          563.0,
          644.0
        ],
        [
          552.0,
          662.0
        ],
        [
          553.0,
          698.0
        ],
        [
          537.0,
          713.0
        ],
        [
          506.0,
          714.2
        ],
        [
          510.7,
          880.7
        ]
      ],
      "confidence": 0.8
    },
    {
      "id": "wheeler-L4-v01-link",
      "a": "wheeler-L4-v01j",
      "b": "wheeler-L4-v01",
      "kind": "corridor",
      "polyline": [
        [
          563.0,
          644.0
        ],
        [
          503.5,
          570.0
        ]
      ],
      "confidence": 0.6
    },
    {
      "id": "wheeler-L4-e002ab",
      "a": "wheeler-L4-v02j",
      "b": "wheeler-L4-v01j",
      "kind": "corridor",
      "polyline": [
        [
          1439.0,
          652.0
        ],
        [
          1439.0,
          652.0
        ],
        [
          563.0,
          644.0
        ]
      ],
      "confidence": 0.8
    },
    {
      "id": "wheeler-L4-v02-link",
      "a": "wheeler-L4-v02j",
      "b": "wheeler-L4-v02",
      "kind": "corridor",
      "polyline": [
        [
          1439.0,
          652.0
        ],
        [
          1475.0,
          575.8
        ]
      ],
      "confidence": 0.6
    },
    {
      "id": "wheeler-L4-v03-link",
      "a": "wheeler-L4-n001",
      "b": "wheeler-L4-v03",
      "kind": "corridor",
      "polyline": [
        [
          1303.2,
          805.0
        ],
        [
          1301.3,
          734.6
        ]
      ],
      "confidence": 0.6
    },
    {
      "id": "wheeler-L4-e002bb",
      "a": "wheeler-L4-v04j",
      "b": "wheeler-L4-n003",
      "kind": "corridor",
      "polyline": [
        [
          510.7,
          880.7
        ],
        [
          510.7,
          880.7
        ],
        [
          485.0,
          905.0
        ],
        [
          428.0,
          905.0
        ],
        [
          422.0,
          915.0
        ],
        [
          422.0,
          1734.0
        ],
        [
          426.0,
          1749.0
        ],
        [
          444.0,
          1749.0
        ],
        [
          466.0,
          1767.0
        ],
        [
          483.0,
          1791.0
        ]
      ],
      "confidence": 0.8
    },
    {
      "id": "wheeler-L4-v04-link",
      "a": "wheeler-L4-v04j",